{
  "common": {
    "loading": "Chargement...",
    "error": "Erreur",
    "success": "Succ√®s",
    "cancel": "Annuler",
    "submit": "Soumettre",
    "close": "Fermer",
    "back": "Retour",
    "next": "Suivant",
    "save": "Enregistrer",
    "delete": "Supprimer",
    "edit": "Modifier",
    "view": "Voir",
    "search": "Rechercher",
    "filter": "Filtrer",
    "sort": "Trier",
    "language": "Langue"
  },
  "main": {
    "title": "R√©humaniser Notre Monde.",
    "subtitle": "Warmthly est un mouvement mondial pour faire de l'empathie une partie mesurable de nos syst√®mes.",
    "donate": "Soutenir la Mission",
    "donateButton": "ü§ç Soutenir la Mission"
  },
  "mint": {
    "title": "Monnayer",
    "description": "Nous suivons chaque centime et chaque d√©cision juste devant vous. C'est notre engagement envers vous que nous suivrons toujours et fournirons une transparence maximale pour chacune de nos actions et chacune de vos donations."
  },
  "post": {
    "title": "Publier",
    "subtitle": "Une chronologie vivante de l'histoire de notre organisation, des moments fondateurs aux plans futurs. Chaque d√©cision, jalon et interaction communautaire est enregistr√©e ici pour une transparence totale."
  },
  "vote": {
    "title": "Le Vote de Dissolution",
    "description": "Notre engagement est envers notre mission et nos valeurs : Transparence, Honn√™tet√©, Humilit√© et Empathie. Si nous ne les respectons pas, nous pensons que nous devrions cesser d'exister. Cette page est notre interrupteur d'arr√™t tenu par la communaut√©."
  },
  "report": {
    "title": "Signaler un Probl√®me",
    "description": "Si vous avez des pr√©occupations, des questions ou besoin de signaler quelque chose li√© √† Warmthly, veuillez utiliser le formulaire ci-dessous. Nous prenons tous les rapports au s√©rieux et les examinerons rapidement."
  },
  "yourData": {
    "title": "Vos Donn√©es",
    "description": "Transparence Radicale : Voici tout ce que nous stockons √† votre sujet. Si vous voyez quelque chose que nous n'avons pas mentionn√©, signalez-le."
  }
}

