{
  "common": {
    "loading": "Cargando...",
    "error": "Error",
    "success": "xito",
    "cancel": "Cancelar",
    "submit": "Enviar",
    "close": "Cerrar",
    "back": "Atr谩s",
    "next": "Siguiente",
    "save": "Guardar",
    "delete": "Eliminar",
    "edit": "Editar",
    "view": "Ver",
    "search": "Buscar",
    "filter": "Filtrar",
    "sort": "Ordenar",
    "language": "Idioma"
  },
  "main": {
    "title": "Rehumanizar Nuestro Mundo.",
    "subtitle": "Warmthly es un movimiento global para hacer de la empat铆a una parte medible de nuestros sistemas.",
    "donate": "Apoyar la Misi贸n",
    "donateButton": " Apoyar la Misi贸n"
  },
  "mint": {
    "title": "Acu帽ar",
    "description": "Rastreamos cada centavo y cada decisi贸n nuestra justo delante de ti. Es nuestro compromiso contigo que siempre rastrearemos y proporcionaremos la m谩xima transparencia para cada acci贸n nuestra y cada donaci贸n tuya."
  },
  "post": {
    "title": "Publicar",
    "subtitle": "Una l铆nea de tiempo viva de la historia de nuestra organizaci贸n, desde los momentos fundacionales hasta los planes futuros. Cada decisi贸n, hito e interacci贸n comunitaria se registra aqu铆 para una transparencia completa."
  },
  "vote": {
    "title": "El Voto de Disoluci贸n",
    "description": "Nuestro compromiso es con nuestra misi贸n y valores: Transparencia, Honestidad, Humildad y Empat铆a. Si no los cumplimos, creemos que deber铆amos dejar de existir. Esta p谩gina es nuestro interruptor de apagado mantenido por la comunidad."
  },
  "report": {
    "title": "Reportar un Problema",
    "description": "Si tiene inquietudes, preguntas o necesita reportar algo relacionado con Warmthly, use el formulario a continuaci贸n. Tomamos todos los informes en serio y los revisaremos de inmediato."
  },
  "yourData": {
    "title": "Tus Datos",
    "description": "Transparencia Radical: Esto es todo lo que almacenamos sobre ti. Si ves algo que no mencionamos, rep贸rtalo."
  }
}

