{
  "common": {
    "loading": "Laden...",
    "error": "Fehler",
    "success": "Erfolg",
    "cancel": "Abbrechen",
    "submit": "Senden",
    "close": "Schlie√üen",
    "back": "Zur√ºck",
    "next": "Weiter",
    "save": "Speichern",
    "delete": "L√∂schen",
    "edit": "Bearbeiten",
    "view": "Ansehen",
    "search": "Suchen",
    "filter": "Filtern",
    "sort": "Sortieren",
    "language": "Sprache"
  },
  "main": {
    "title": "Unsere Welt Rehumanisieren.",
    "subtitle": "Warmthly ist eine globale Bewegung, um Empathie zu einem messbaren Teil unserer Systeme zu machen.",
    "donate": "Die Mission Unterst√ºtzen",
    "donateButton": "ü§ç Die Mission Unterst√ºtzen"
  },
  "mint": {
    "title": "Pr√§gen",
    "description": "Wir verfolgen jeden Cent und jede Entscheidung direkt vor Ihnen. Es ist unser Engagement Ihnen gegen√ºber, dass wir f√ºr immer jede unserer Aktionen und jede Ihrer Spenden verfolgen und gr√∂√ütm√∂gliche Transparenz bieten werden."
  },
  "post": {
    "title": "Ver√∂ffentlichen",
    "subtitle": "Eine lebendige Zeitleiste der Geschichte unserer Organisation - von den Gr√ºndungsmomenten bis zu zuk√ºnftigen Pl√§nen. Jede Entscheidung, jeder Meilenstein und jede Gemeinschaftsinteraktion wird hier f√ºr vollst√§ndige Transparenz aufgezeichnet."
  },
  "vote": {
    "title": "Die Aufl√∂sungsabstimmung",
    "description": "Unser Engagement gilt unserer Mission und unseren Werten: Transparenz, Ehrlichkeit, Demut und Empathie. Wenn wir sie nicht einhalten, glauben wir, dass wir aufh√∂ren sollten zu existieren. Diese Seite ist unser von der Gemeinschaft gehaltener Notausschalter."
  },
  "report": {
    "title": "Ein Problem Melden",
    "description": "Wenn Sie Bedenken, Fragen haben oder etwas im Zusammenhang mit Warmthly melden m√ºssen, verwenden Sie bitte das untenstehende Formular. Wir nehmen alle Meldungen ernst und werden sie umgehend √ºberpr√ºfen."
  },
  "yourData": {
    "title": "Ihre Daten",
    "description": "Radikale Transparenz: Dies ist alles, was wir √ºber Sie speichern. Wenn Sie etwas sehen, das wir nicht erw√§hnt haben, melden Sie es."
  }
}

